product_url,category,common_name,common_name_alternate,description,name_origin,center_origin_notes,food_basket,nutrition_notes,preparation_notes,storage_notes
coco,fruta,coco,pipa,"Si no desea complicarse en la cocina elaborando postres, helados, o flanes de coco, siempre le quedará la opción de disfrutar crudos su pulpa y su refrescante jugo. No obstante, tome en cuenta que al hacer un auténtico rice and beans caribeño, sería casi un sacrilegio no incluir el aceite de coco en la cocción. ",,"El coco ha tenido un papel muy importante en la historia de la humanidad, no solo ha sido un alimento sino también es fuente de agua y aceite. Por su resistencia se utilizó como material de construcción para los hogares en las zonas tropicales. Y observamos que en la India y Asia el coco se ha utilizado con fines medicinales.",True,"El coco, en todas sus formas, rebosa de antioxidantes y colesterol saludable que ayuda a eliminar el colesterol no deseado del cuerpo. Además, posee propiedades antibacterianas y es una fuente excepcional de hidratación. Como prueba de su naturaleza integral, en casos extremos, es factible mantener una dieta saludable centrada en gran medida en coco.",,"Una vez partido, se puede sumergir en un recipiente con agua y colocarlo en el refrigerador"
coldebruselas,verdura,col de Bruselas,,"Col de bruselas o repollito: digestiva, antiinflamatoria verdura de renombre como antibiótico natural. Se deja comer lo mismo hervida que asada, al horno, preferiblemente con mantequilla, como ensalada o salteada como guarnición. No solo el buen perfume viene en envase pequeño: ahí está la Col de Bruselas como prueba para demostrarlo.",,"Llamadas así en honor a la ciudad que las cultivó por primera vez, Bruselas en Bélgica, esta verdura sufrió de mala fama debido a su amargo sabor. Sin embargo, gracias a la polinización cruzada, las nuevas generaciones exhiben un delicioso sabor. En la actualidad, en Bélgica se disfrutan hervidas, acompañadas de cebolla y mantequilla.",False,"Con más del doble de las proteínas que aporta el repollo, la col de bruselas ha sido incluida dentro de la lista de los mejores vegetales, pues contiene altos niveles de los 17 nutrientes esenciales que previenen problemas del corazón y el cáncer.",,Colocarla en el lugar menos frío del refrigerador y es importante no guardarlas en bolsas herméticas
coladecaballo,hierba,cola de caballo,,"Con solo ver esta hierba, es claro de dónde viene su nombre. La cola de caballo, no sólo ayuda como un diurético natural, sino que también tiene grandes usos en el jardín, dónde se puede utilizar como pesticida natural.",,"De origen mediterráneo, la cola de caballo es un diurético natural cuyos tallos ocasionalmente se consumen en la costa sur de España, lo mismo que los espárragos, fritos o al vapor.",False,"La cola de caballo destaca como un diurético natural ideal para combatir problemas renales. Ninguna otra planta posee una concentración mayor de sílice, por lo que esta hierba es ideal para potenciar la generación de colágeno y el crecimiento del cabello.",,
coliflor,verdura,coliflor,,"Rica en potasio, fósforo y vitaminas B y C, la coliflor puede comerse cruda, al vapor, hervida, e, incluso, frita. Si usted quiere adelgazar o controlar su hipertensión, inclúyala con frecuencia en su menú. En el podio de premiaciones para las verduras, siempre habrá una medalla reservada para la coliflor.",,"Oriunda del Mediterráneo Oriental y el Asia menor, la coliflor, cultivada en tiempos ancestrales para ser empleada como fármaco natural contra diarreas y dolores de cabeza, hoy se incluye en incontables recetas gastronómicas. El estofado libanés de coliflor es una gema gourmet del Cercano Oriente.",False,"Su notable cantidad de fibra mejora el funcionamiento del tránsito intestinal, y su riqueza en potasio y fósforo refuerza huesos y músculos, a la vez que su alto contenido de vitaminas C y B ayuda a prevenir la anemia y contribuye al crecimiento celular.",,Conservarla en el cajón de las verduras del refrigerador
cubaces,legumbre,cubaces,,"No hay mejor leguminosa que los cubaces para robarse el show en cualquier mesa donde se sirva un chifrijo. Para comer con carnes, lomo, costillas o patas de cerdo, en guisos o con verduras, tampoco dejan los calóricos y proteicos cubaces que los bajen de la tarima. ",,"Los frijoles, nativos de América Central y del Sur, encuentran una variante única nacida en Costa Rica, los frijoles cubaces. A diferencia de los frijoles convencionales, estos se disfrutan principalmente con carnes, como en el popular plato típico ""chifrijo"".",False,"El folato presente en los cubaces es elemento de peso en la formación de glóbulos rojos sanos y muy necesario en la prevención de malformaciones fetales en mujeres embarazadas. Ricos en fibra, también reducen los niveles del colesterol dañino.",,En un lugar con poca luz y humedad
culantro,hierba,culantro,,"Ya sea como un ingrediente que aporta su aroma y su sabor ligeramente cítrico y refrescante en salsas, frijoles, sofritos, cremas; o en ensaladas, ceviches, incluso como té, el aporte de las hojas de culantro se agradece siempre en el paladar, y en nuestra salud, por su valor agregado como analgésico y antiinflamatorio.  ",,"De origen incierto, parece haber tenido el culantro su cuna en el Mediterráneo oriental, donde se le utiliza para condimentar las carnes. En la región Oriental del África mediterránea es ingrediente insustituible del cuscús y el falafel.",True,"Antioxidantes como la quercetina, los tecoferoles y el terpinene, presentes en el culantro, pueden estimular favorables efectos anticancerígenos,neuroprotectores e inmunoestimulantes en el organismo.",,Guardar en un recipiente cubierto con papel absorbente
culantrocoyote,hierba,culantro coyote,,"Rico en ácido fólico y vitaminas A y C, el culantro coyote es hierba aromática con un sólido aroma que se agradece al elaborar sopas, frijoles, carnes, guisos y aderezos. Fuente también generosa del necesario hierro, no hay anemia que se atreva a plantarle cara al culantro coyote. ",,"Originario de América Tropical, el culantro coyote se erige como un elemento clásico en la gastronomía amazónica del Perú. En Panamá, donde su demanda es elevada, se fusiona con perejil, ajo y cebolla para dar vida al ""recao verde"", un condimento esencial en sopas y guisos. En México, encuentra su propósito en la sazón del arroz.",True,"A los monoterpenos, fenilpropanoides y sesquiterpenoides encontrados en los aceites esenciales de esta planta, se les atribuyen efectos antiinflamatorios, antioxidantes, anticonvulsionantes, antihelmínticos y anticonceptivos. El hierro, calcio y vitamina C que le acompañan, contribuye a paliar las anemias.",,Guardar en un recipiente cubierto con papel absorbente
curcuma,raiz,cúrcuma,,"Cúrcuma: Colorante infalible y aromatizante proveniente de la India, la cúrcuma puede utilizarse fresca o seca. Utilícela seca como condimento de arroces, sopas o asados a la parrilla. Como parte de adobos o al marinar, aproveche la raíz fresca de esta especia ya infaltable en la cocina. Además, con ella se hace un excelente té, el cual es muy recomendado a causa de sus propiedades antiinflamatorias",,"La cúrcuma, nativa del Archipiélago indo-malayo, es más que una especia. Enraizada en la historia con más de 4000 años de uso medicinal, teñía túnicas budistas y se usaba en rituales matrimoniales hindúes. En los currys característicos de la cocina de la región no falta la cúrcuma como condimento.",False,"Con una amplia historia medicinal, la cúrcuma exhibe potentes propiedades antiinflamatorias y antioxidantes, encerradas en sus curcuminoides. Estos componentes son absorbidos por el cuerpo de manera más eficaz cuando se consumen junto con pimienta negra.",,En un lugar con poca luz y humedad
eneldo,verdura,eneldo,,"Aunque suene como apellido de abuelito, el eneldo es una hierba muy importante en diversas gastronomías mundiales. Su principal fortaleza es la de cargar de aroma y sabor a diversos platillos. Sin embargo, también es muy utilizado en la medicina alternativa",,"Para comer mariscos, pescados o sopas, es habitual el uso del eneldo en toda Europa Continental. La tostada de tomate, feta y eneldo es un bocadillo  usual en la cocina de la región mediterránea, su lugar de origen.",False,"Sus amplias cantidades de hierro, calcio y vitamina D promueven el crecimiento y la regeneración de los huesos. Además de ser un conocido antiinflamatorio, el eneldo es una excelente hierba para bajar los niveles de colesterol malo y triglicéridos.",,Envuelto en papel absorbente en una bolsa de plástico
esparrago,verdura,espárrago,,"En su idónea simplicidad, al espárrago lo conforma un tallo esbelto y tierno envuelto en un sabor terroso y suave. Este diurético natural se presta a la creatividad, ya sea asado, salteado o al vapor. Disfrútelo crudo, si lo que busca es una merienda nutritiva.",,"El espárrago es una verdura de origen mediterráneo. Al sur de España se les consume mayormente salteados a la sartén con huevo, roquefort, piñones y champiñones, al vapor, o asados a la plancha.",False,"Abundante en potasio, el espárrago es un aliado de la salud renal y cardíaca. Su contenido en el aminoácido asparagina lo convierte en un destacado diurético, eficaz para prevenir y combatir el edema.",,Envueltos en papel de cocina húmedo
espinaca,verdura,espinaca,,"Verdura antioxidante con alto valor proteico, rica, además, en fibra y minerales de hierro y potasio, no por gusto el legendario y musculoso Popeye la escogió como su primer alimento. Cruda o cocida, en sopas o en ensaladas, salud de hierro se augura a todo el que generosamente la consuma.",,"Oriunda de Asia Central, la espinaca, ingrediente de ensaladas, cocidos al vapor y sopas, ofrece también en la China el tinte de su rojo fruto para sellos oficiales y como colorante labial.",False,"Rica en fibra y reconocida por su notable contenido proteico, con 12.6 gramos por cada 100 calorías, la espinaca también es una potencia vitamínica, con altas dosis de vitaminas A, C y K. Estas vitaminas no solo fortalecen nuestros huesos, sino que también potencian nuestro sistema inmunológico.",,Guardar en un recipiente hermético en la parte baja del refrigerador 
estragon,hierba,estragón,,"No hay auténtico mojito cubano sin estragón, versátil y aromática hierba, condimento y aliño a la vez de carnes blancas y rojas, sopas y ensaladas. Digno de aplausos por sus propiedades antioxidantes y digestivas, y rico en potasio, hierro y vitaminas A, B6 y C, el estragón será por siempre un aliado de su buena salud.",,"Proveniente de Asia Central y Siberia, la variedad más aromática del estragón es la francesa, ampliamente utilizada en la cocina de Francia para realzar salsas y condimentar carnes. En países como Georgia y Rusia, el estragón encuentra su hogar en la Tarkhuna, una popular bebida gaseosa a base de estragón.",False,"Su elevado contenido de fibra regula el tránsito intestinal, y su alta dosis natural de vitamina C, rico antioxidante, retrasa el envejecimiento y combate los radicales libres. El ácido salicílico presente en el estragón funciona como sedante contra los dolores de cabeza.",,En un lugar con poca luz y humedad
fresa,fruta,fresa,,"Absolutamente congruentes su estilizado perfil estético y su grato sabor. La fresa, antioxidante infalible y reductora ejemplar de la presión arterial, suele comerse cruda, en batidos, en mermeladas, pasteles, helados, cereales y yogurt.",,"La fresa, de origen mediterraneo, es de la misma familia que las rosas. Combinadas con nata o vino son un platillo clásico en la Europa Mediterránea. Las fresas recubiertas de chocolate caliente tienen su origen en Chicago, EE.UU, pero rápidamente se extendió por todo el mundo la receta como símbolo de agasajo a un ser querido.",True,"Por su alto contenido de vitamina C y manganeso, la fresa contribuye a mantener la salud de los huesos y protege nuestras células contra el daño oxidativo. Rica en fibras, la fresa también contribuye a sostener un intestino saludable.",,En un recipiente hermético cubierto con papel absorbente
frijol,legumbre,frijol,,"La variedad de platos que podrá elaborar con cualquiera de los colores dentro de la gama que ofrece el frijol, lo convierte en una legumbre multifacética. Ya sea en sopas, refritos, empanadas o, acompañando en el pinto a su inseparable hermano el arroz, no hay manera de servir una buena mesa sin el frijol.",,"Producto de origen Mesoamericano, y grano base en la dieta de las poblaciones indígenas.  En nuestro país, es utilizado principalmente en el platillo típico “gallo pinto”. Sin embargo en otras culturas como la Mexicana podemos observar que se utiliza de forma muy variada como por ejemplo en sopes, frijoles charros y enfrijoladas.",True,"Siendo notables por su aporte en fibra, los frijoles reducen el colesterol malo y aumentan la cantidad de bacterias buenas en el organismo. Su aporte en minerales como potasio, hierro y fósforo, reduce el riesgo de contraer enfermedades cardíacas. ",,En un lugar con poca luz y humedad
garbanzo,legumbre,garbanzo,,"Los garbanzos, versátiles y ricos en proteínas, se integran perfectamente en carnes, sopas, pastas, sándwiches, ensaladas o en un delicioso hummus casero. Además, estas legumbres, al aumentar su tamaño hasta tres veces al cocinarse, llenan el estómago hasta la saciedad.",,"Nacidos en Syria y Turquía, los garbanzos son un componente imperdible en la cocina india y del Medio Oriente. Estos son los protagonistas del conocido hummus, una pasta de garbanzos emblemática en la gastronomía de la región. En el sur de Asia, la harina de garbanzo se emplea para empanizar y freír vegetales.",False,"Su riqueza en potasio, hierro y ácido fólico reduce la hipertensión arterial y contribuye con nuestra salud cardiovascular, a la vez que sus compuestos del complejo vitamínico B son un soporte para el buen estado del sistema nervioso.",,En un lugar con poca luz y humedad
granadilla,fruta,granadilla,,"Licuada y mezclada con agua o con leche y algo de azúcar o miel, la pulpa de la fruta de la granadilla termina siendo un jugo o un batido impostergable. Pero, además, pescados, pollos, cócteles, ensaladas y mariscos miran siempre agradecidos a la granadilla cuando esta se ofrece a acompañarlos en la preparación de diversos platillos culinarios.  ",,"Nativa de las montañas de Colombia, Bolivia y Venezuela, esta planta, hermana de la granada, destaca por su notable dulzura. La común preferencia de la región por consumirla cruda es un testimonio de su sabor excepcional.",True,"Junto con las bayas, la granadilla destaca como la fruta más rica en fibra por taza, con una notable concentración tanto en sus semillas como en su pulpa. Además, es una excelente fuente de vitaminas C y A, y una opción ideal para mantener la piel hidratada y radiante.",,
guanabana,fruta,guanábana,,"¡Una delicia en fresco! La guanábana es dulce y refrescante, lo que la hace un fruto muy popular en Costa Rica. Su deliciosa pulpa blanca es protegida por el exterior verde y espinas de la fruta. ¡Ven como no hay que juzgar a un libro por su portada!",,"Fruta nativa de Mesoamérica y Sudamérica, en México se utiliza su pulpa en la elaboración de helados, dulces, yogures, ensaladas, jugos y cocteles. También en México, sus semillas pulverizadas se usan como repelente contra insectos.",True,"Entre las frutas con mayor aporte de vitamina C y potasio, su pulpa posee efectos antidiarreicos y antiparasitarios y es comúnmente utilizada para incrementar la producción de leche materna.",,Se puede congelar la pulpa de esta para que dure más tiempo
guayaba,fruta,guayaba,,"Autora de quizás la mermelada más icónica de la región, la guayaba contiene incluso más vitamina C que los cítricos, por lo que está a la cabeza cuando de fortalecer nuestro sistema inmunológico se trata. Con su masa suave y cremosa, cada mordisco es un testimonio de la generosidad de la naturaleza. ",,"Originaria de Mesoamérica, la guayaba, puede usted allí lo mismo comérsela a mordiscos que utilizar sus hojas para formar un aromático cigarrillo.",True,"Encabezando la lista en cuanto a aporte de potasio y vitamina C, la guayaba puede contribuir a bajar la presión arterial. Su contenido en fibra ayuda a mejorar los procesos digestivos y a aliviar los síntomas del estreñimiento.",,Puede introducirse en bolsas herméticas con un agujero para que entre el aire
guisante,legumbre,guisante,"abejaquilla, alvilla, arbeja, arbella, arveja, arvejana, arvejo, arvejote, arvejón, bisaltera, bisaltero, bisalto, bisantes, bisarto, chicharro, chícharo, cuchillejo, disante mayor, disante menor, fasolera, garbaneta, guisante, guisante ordinario, guisantera, guisón, haberos, ilar, moros, nanos, pelailla, pequeñicos, poa, prinsol, présoles, pésole, tabilla, tirabeques, tres reyes.  ","Para comer como un guiso, en cremas, acompañando otras verduras, como guarnición, o mezclado con arroz, los guisantes son, por su versatilidad culinaria y altos valores nutritivos, el pequeño gigante de la cocina. Si usted quiere, además, reducir sus niveles de colesterol, inclúyalo con frecuencia en sus comidas. ",,"Los guisantes se cultivan en Asia Menor, su lugar de origen, desde hace miles de años. Sus cosechas se recogen sin llegar al estado de maduración, y de ahí su color verde. La mayor parte de las cosechas de guisantes se utiliza en la elaboración de piensos para animales.",False,"Ricos en proteínas necesarias para el desarrollo de los músculos, los guisantes son notable fuente de fibra, que mejora el tránsito intestinal y reduce el estreñimiento; y de ácido fólico, que previene malformaciones congénitas en el embarazo.",,En un recipiente cerrado
hierbabuena,hierba,hierbabuena,,"Ciertamente buena, esta hierba mentolada, preparada en forma de té o infusiones, ayuda a paliar problemas digestivos, intestinales y del hígado, y reduce los mareos. Su fresco sabor prevalece en las ensaladas y en las salsas que con hierbabuena se elaboran para acompañar algunas carnes.",,"De misterioso origen, se cree que la hierbabuena emergió en el Mediterráneo, África del Norte y ciertas regiones de Asia. En Egipto, llegó a utilizarse como moneda. Gracias a su sabor distintivo, la hierbabuena conquistó rápidamente el mundo de los dulces en Europa. Las bolas de brandy, fusionando hierbabuena y canela, se convirtieron en la sensación inglesa en la década de 1850.",False,"Por ser rica en componentes como vitamina A, hierro y magnesio, la hierbabuena mejora los niveles de hemoglobina. Esta además exhibe propiedades antisépticas y antiinflamatorias.",,En un recipiente con papel absorbente un poco humedecido
hinojo,verdura,hinojo,,"Verdura de milenaria utilidad, no es poca la historia humana que su culinario pedigree ha visto pasar, crudo o cocido, desde las hojas hasta el bulbo, entre caldos, pescados y guisos, el vitamínico y anisado hinojo.  ",,"Originaria del Mediterráneo, esta hierba, empleada en la antigüedad en días de ayuno para saciar el hambre, se utiliza hoy prolijamente en Italia para condimentar carnes, siendo también una favorita en las ensaladas de la cocina mediterránea.",False,"El potasio presente en el hinojo ayuda a regular la presión arterial, mientras otro de los minerales que lo conforman, el magnesio, contribuye a la formación de proteínas y de masa ósea, e influye en el buen estado de los músculos y el sistema nervioso. Sus flavonoides tienen propiedades antiinflamatorias y mejoran la condición de los vasos sanguíneos y el sistema digestivo.",,Puede guardarse en un recipiente con un poco de agua
hongo,otro,hongo,,"Secos, asados, salteados, como condimento para sopas, o como guarnición para acompañar pastas, carnes, verduras o pescados, los hongos comestibles, además de su exótica manera de dejarse ver, aportan una carga considerable de vitaminas, minerales y proteínas. ",,"Los hongos comestibles se reportaron por primera vez en la cuenca mediterránea y en la China. El clásico champiñón a la mediterránea es un acompañante insustituible en platos de pastas, verduras asadas, y carnes.",False,"Su aporte en fibra contribuye al cuidado de la microbiota intestinal y el mantenimiento del peso corporal en parámetros aceptables, al tiempo que sus vitaminas del grupo B contribuyen a metabolizar grasas y proteínas, mientras su alto contenido de selenio funciona como antiinflamatorio. ",,En un recipiente con papel absorbente
jengibre,raiz,jengibre,,"Su sabor picante contribuye a resaltar los sabores de varios platos. Fresco y rallado, enriquece las ensaladas, los sofritos, las salsas. De invaluable ayuda al marinar carnes y pescados, el jengibre tiene además un valor agregado como analgésico, antiinflamatorio y antiséptico.",,Producto sumamente importante y de gran valor economico en la Europa medieval utilizado como especia para condimentar una variedad de platillos. A nuestros dias podemos encontrarlo con facilidad para darle sabor a nuestros platos.,False,"Con elevado contenido de flavonoides, taninos y gingerol, el jengibre es un antioxidante, antibacteriano y anti cancerígeno que retrasa el envejecimiento celular y combate los radicales libres. Por su alta cantidad de magnesio, fósforo y calcio, previene los espasmos y la debilidad muscular. ",,En un lugar seco y oscuro
jocote,fruta,jocote,,"Rico en vitamina C y antioxidantes, el agridulce fruto del jocote es parte importante de la cultura tica y su amplio espectro culinario va desde el pan de jocote, las mermeladas, los frescos y los pasteles, hasta el simple jocote con sal.",,"Nativo de Mesoamérica, en México con el jocote verde se prepara una salsa agria, o son encurtidos en vinagre para comer con chile picante y sal. Al norte de América Central sus hojas se comen cocidas como vegetales.",False,"Rico en vitaminas A, B y C, el jocote previene resfriados e infecciones y por tanto revitaliza el sistema inmune y funciona como antioxidante. Por su aporte en fibra e hierro, el jocote ayuda a regular el peso corporal y combatir la falta de glóbulos rojos, reduciendo la posibilidad de enfermar por anemia.",,
kale,verdura,kale,col rizada,"Si hubiera un premio por la verdura más saludable, la col rizada (o kale) estaría en los primeros lugares. Una fuente enorme en vitaminas y minerales; además de tener un bajo contenido calórico, el kale se puede usar en batidos, ensaladas o hasta cruda.",,"El kale es originario del mediterraneo, sin embargo a lo largo de los años ha tomado popularidad  en diferentes lugares del mundo debido a su versatilidad. Un dato importante es que el Kale al igual que el brócoli, la coliflor, las coles de bruselas y el repollo son variedades de una misma especie de planta. Al tener esta versatilidad lo podemos encontrar en el famoso plato tradicional alemán “Grünkohl mit Pinkel” salchicha acompañada de Kale cocido.O bien también lo podemos comer crudo en ensaladas y batidos.",False,"Con cantidades de calcio tan altas como la leche, el kale, rico en fibra y vitaminas A y C, es de los vegetales con la mayor cantidad de nutrientes por cada 100 gramos. Este es además un buen acompañamiento para comidas altas en carbohidratos ya que previene picos de glucosa.",,Envuelto en papel de cocina en un contenedor o bolsa hermética
kiwi,fruta,kiwi,,"Incluida entre las frutas que más contribuyen a consolidar la salud humana, el kiwi destaca por su sólida carga vitamínica. De sabor inconfundible, su verde pulpa se disfruta de forma singular. Puede usted incluirlo como parte de un delicioso coctel de frutas, en un batido, o, incluso, degustarlo como mermelada.",,"El kiwi es oriundo del Asia Oriental. Cortado en rodajas, en Japón el kiwi se utiliza con frecuencia para acompañar platos de pescado crudo (generalmente salmón o atún) y como ingrediente en ensaladas de vegetales o algas.",False,"Rico en ácido fólico y vitamina C, el kiwi es una potencia inmunoestimulante que puede ayudar a acortar gripes y a acelerar la sanación de heridas por su contenido en vitamina K.",,"En un lugar fresco, seco y alejado de la luz"
lechuga,verdura,lechuga,,"La lechuga está compuesta por alrededor de un 95% de agua, lo que le aporta un toque extra fresco a sus comidas y la convierte en un alimento altamente hidratante. Desate todo su potencial al combinarla con otros ingredientes, ya sea en ensaladas, sándwiches o wraps.",,"De una hierba silvestre al componente estrella en la ensalada griega. La lechuga fue inicialmente cultivada por los griegos y romanos por sus semillas ricas en aceite, pero rápidamente sus hojas se robaron el show en las recetas verdes de todo el mundo.",True,"Fuente de vitamina A y fibra, mientras más oscuras son sus hojas más antioxidantes contienen, por lo que sus variedades más claras poseen menos nutrientes que la mayoría de vegetales. A pesar de esto, por su contenido en fibra y agua, la lechuga es un alimento altamente saciador, por lo que es ideal para incorporar a una dieta baja en calorías.",,Envuelto en papel de cocina en un contenedor o bolsa hermética
