product_url,category,common_name,common_name_alternate,description,name_origin,center_origin_notes,food_basket,nutrition_notes,preparation_notes,storage_notes
acelga,verdura,acelga,,"La acelga, al igual que la espinaca, brilla en ensaladas, pues aporta frescura y un inmenso valor nutricional. Reconocida por su alto aporte en minerales y vitaminas esenciales, es la adición perfecta para una dieta equilibrada.",,"La cocina etíope, rica en opciones vegetarianas, ha visto nacer a la acelga en sus tierras y ha sido la primera en acogerla como un ingrediente esencial en sus deliciosas recetas verdes.",False,"La acelga, rica en vitaminas A, C y K y minerales esenciales para el buen funcionamiento del organismo, como magnesio, hierro y potasio, también ayuda a regular los procesos digestivos. Su elevado contenido de vitamina K ayuda a mantener sanos los huesos y la sangre.",,En un recipiente cerrado con poca humedad
aguacate,fruta,aguacate,palta,"¿Fruta o verdura? No importa, igual es delicioso. El aguacate es parte importantísima de nuestra dieta y de nuestra cultura. Es un alimento muy nutritivo y versátil, que se puede comer en ensaladas, guacamole y salsas, ¡y también en recetas dulces!",,"Esta fruta fue sumamente importante en la dieta de las culturas nativas de Mesoamérica, y hasta nuestra época sigue siendo un alimento dinámico que se utiliza tanto para platillos dulces como salados.",True,"Entre sus más sólidos nutrientes cuenta el aguacate con las vitaminas A, C y E. El aguacate es un reductor natural de los niveles de colesterol malo en sangre gracias a su destacada oferta de grasas saludables.",,El jugo de limón conservará la superficie del aguacate para evitar que se oscurezca
ajo,verdura,ajo,,"Aleja a los vampiros, pero atrae a los buenos sabores a los platos. Integrante estrella de la triada de la sazón junto con el ajo y el chile dulce, no hay sofrito que se respete sin la presencia de un diente de ajo. Este saborizante natural,además, fortalece su sistema inmunológico.",,"Aparte de ser utilizado como un condimento para los alimentos, también se ha utilizado en la India como loción antibacterial para lavar heridas. Esto debido a sus propiedades antisépticas.",True,"Aunque su base nutricional se apoya sobre todo en sus componentes sulfurados (alicina, dialil sulfidos), el ajo también aporta fósforo, potasio, magnesio, selenio, vitamina B6, yodo y proteínas. Su consumo fortalece además los vasos sanguíneos.",,Siempre en un sitio oscuro y seco
albahaca,hierba,albahaca,"albaca, alfábega, alhábega",Lleve sus platos de pasta a un nivel superior con el sabor agregado de la albahaca. Incorpore a las ensaladas su aroma mediterráneo o termine su día preparándola como un té relajante.,,"Especie aromática reconocida por el gran sabor que le brinda a los alimentos, conocida también por la utilización como planta curativa en la medicina tradicional ayurveda de la India.",False,"Rica en calcio, potasio, vitaminas A, B1 y C, hierro, sodio, fósforo, proteínas y fibra vegetal, a la albahaca se le emplea para estimular la producción de leche materna, disminuir los gases, como analgésico, cicatrizante y solución capilar, digestivo y estimulante del apetito.",,Guardar las hojas en un recipiente envueltas en papel de cocina para que absorba la humedad
alfalfa,hierba,alfalfa,"afalfe, afarfa, alfal, alfalce, alfalce bordo, alfalfa , alfalfa brava, alfalfa mansa, alfalfa silvestre, alfalfe, alfalz, alfance, alfange, alfarfa, alfauce, alfaz, alfás, alholva, almierca, amelca, amielcas, arfarfa, carretón, carretón borde, ervaye, falfa, farfa, melga, merga, miajera, mielca, mielcón, mielga, mielgas, mierga, miergas, mierpes, nielga, probayernos, trebolillo, trébol de España, zarza.","Igual que su tocayo de ""Los Pequeños Traviesos"", la alfalfa es una hierba bastante tenaz, ya que se adapta sin problemas a climas fríos y cálidos. Usualmente utilizada en ensaladas, la alfalfa también puede tener usos bastante controvertidos en sándwiches y sopas.",,"Se ha utilizado como alimento en partes de Rusia, China y América, por ejemplo, en la preparación de tortillas, té, croquetas, sopas y ensaladas crudas y cocidas. Mientras que en Sudáfrica se utiliza ocasionalmente como sustituto de las espinacas.",False,"Abundante en vitamina C, la alfalfa se erige como un antioxidante excepcional y una valiosa fuente de calcio. No solo eso, también despliega su eficacia como un tratamiento para la diabetes, al disminuir la absorción de glucosa en los intestinos y potenciar la generación de insulina.",,Dentro de una bolsa que no seaq hermética
anona,fruta,anona,"chirimoya, sincuya, zuncuya","No se deje engañar por la ruda apariencia de esta fruta, ya que en su interior guarda un tesoro: una masa suave, dulce y cremosa que se puede comer como se le ocurra. Puede hacerla  en jugo o convertirla en su próximo postre favorito. Es el sabor del Caribe en una fruta.",,"Originaria de América del Sur, se cree que la anona tiene sus raíces en Perú y Ecuador. Tradicionalmente, se consume partiendo la fruta por la mitad y disfrutando de su pulpa con cuchara. En Chile, la anona se transforma en un delicioso ponche navideño.",False,"La anona, tesoro fitoquímico de la medicina tradicional, despliega un arsenal nutricional: calcio, potasio e hierro para la salud cutánea y de los tejidos, respaldados por las vitaminas B1, B2, B3 y B9, artífices clave de sus propiedades antioxidantes.",,Lugar ventilado y fresco
apazote,hierba,apazote,"epazote, pazote, epasote, pizate, paico, pasota, pasote","El apazote es una hierba icónica en la cocina mexicana y un ingrediente emblemático en la preparación de frijoles negros. Una pizca de esta hierba llenará de sabor y personalidad sus frijoles, sopas o tamales.",,"Nativo de los suelos arenosos de México, el apazote, condimento arraigado en la cultura culinaria azteca, persiste como un sabor esencial en las recetas mexicanas, desde quesadillas hasta frijoles, y caldos de camarón.",False,"El apazote despliega en sus hojas una rica amalgama de monoterpenos, entre los cuales destaca el ascaridol, reconocido por su eficacia en la erradicación de gusanos intestinales y su utilidad como tratamiento para trastornos digestivos.",,En una bolsa con sello hermético
apio,verdura,apio,"pio, apio acuático,  apio bastardo, apio blanco, apio borde, apio bravo, apio bravío, apio común, apio acuático, apio de agua, apio de arroyo, apio de arroyos, apio de huerta, apio de laguna, apio de las lagunas, apio de los huertos, apio de monte, apio dulce, apio laguna, apio nabo, apio palustre, apio silvestre, celerio, célery, habit, perejil de agua,apio España, panul","Sabor discreto y jugoso, con pocas calorías y mucha fibra, ¿qué no le podría gustar del apio? Ya sea crudo, con aderezos, frito o al vapor, ese ¡crunch! es demasiado bueno para dejarlo pasar. ",,"Originario del Mediterráneo, el apio, en sus inicios medicinal y amargo, fue liberado de sus confines medicinales por hábiles agricultores que suavizaron su sabor. Así, empezando por Suecia, se convirtió el apio en un deleite global disfrutado sin remordimientos.",True,"Añadiendo a su notable contenido de fibra y potasio, el apio es rico en ftalida, un fitoquímico reconocido por su capacidad para relajar las paredes arteriales. Esta propiedad potencia la circulación sanguínea y contribuye a reducir la presión arterial.",,Humedecer una toalla de papel de cocina y envolver las ramas del apio
arandano,fruta,arándano,"mortiño, anavia","Como una lluvia mañanera, el arándano es fresco y tiene un sabor deliciosamente balanceado, ni muy dulce, ni muy ácido. Práctica y de fácil consumo, esta baya azul es la adición ideal para enriquecer sus desayunos con abundantes vitaminas y antioxidantes.",,"Misterioso en su origen, el arándano prospera de forma espontánea en Europa, Asia y Norteamérica, región que alberga su principal productor, Estados Unidos, con más del 95% de la producción global. Tribus nativas norteamericanas lo cosechaban para enriquecer pasteles y carnes.",False,"De notable capacidad antioxidante, el arándano aporta vitamina B3, fundamental para mejorar la función cognitiva en adultos mayores, y vitaminas A, B y C, que fortalecen el sistema inmunológico. Su aporte en potasio contribuye además a fortalecer el corazón.  ",,En un recipiente con papel toalla como base para que absorba la humedad
arracache,raiz,arracache,,"El picadillo preferido de los ""gallos"" de tortilla. El arracache es una raíz que, cuando se cocina, se convierte en una deliciosa guarnición para platos fuertes como, por ejemplo, los famosos casados.",,"Tubérculo de origen andino, el arracache es ingrediente común en la cocina sudamericana. La torta o queque de arracache es un pilar de la cultura gastronómica peruana.",False,"Sus aportes de hierro y calcio ayudan a prevenir la osteoporosis y a mejorar la salud de los dientes, al tiempo que su riqueza en vitaminas del complejo B y C, y zinc, solidifica el sistema inmunológico. Su alto contenido de vitamina B3 ayuda a disminuir los niveles de colesterol y triglicéridos.",,"Se puede lavar, pelar y cortar en trocitos antes de refigerarlo"
arugula,verdura,arúgula,"rúcula, aballicos, alhuceña, aruga, arugua, berza alhuceña, eruca, eruga, hierba meona, jamargo, jamargo blanco, jamarguillo, jaramago, oruga, oruga blanca, oruga de barrancos, oruga pestosa, oruga roqueta, oruga vejigosa, pestosas, picograjo, rabaniza blanca, roqueta, ruca, rucas, ruqueta, tamarillas.  ","Sinónimo de vitalidad y elegancia en los platos, la arúgula es una hierba de sabor picante que puede ser combinada con sus ensaladas habituales para darles un toque extra de sabor y un impulso de calcio a su dieta.",,"Desde su cuna en Etiopía hasta la antigua Roma, la arúgula conquista platos. En Italia, es complemento de ensaladas y pizzas. En Turquía, acompaña cruda al pescado, mientras que en Asia Occidental, sus semillas se transforman en el aceite de taramira. En tiempos recientes, su influencia se expande en restaurantes de América.",False,"Su alto contenido de vitaminas K y C, contribuye a prevenir enfermedades cardiovasculares y mejorar el sistema inmunológico. Sus elevados niveles de vitaminas del complejo B ayuda a prevenir síntomas de anemia y depresión, a metabolizar los azúcares y fortalecer la masa muscular.  ",,Guardar las hojas en un recipiente envueltas en papel de cocina para que absorba la humedad
ayote,verdura,ayote,,"Ya sea como fruta u hortaliza, el ayote se consume de múltiples maneras: al vapor, frito, relleno, hervido, crudo, al horno, seco, en puré, en pasteles e, incluso, encurtido. El reino de la vitamina A tiene plantada una bandera en el ayote.  ",,"Mesoamérica y la región Andina son las cunas del ayote. Preparado con tocino, cebolla, ajo y chile serrano, el ayote (calabaza en México) a la mexicana es un plato abanderado de la cocina azteca.",True,"Fuente de vitamina A, pilar de la salud visual y celular, y del crecimiento, el ayote aporta además vitaminas B1 y B2, que mejoran los procesos metabólicos, y vitaminas C y E, que amurallan el sistema inmunológico y previenen diversos tipos de cáncer. ",,En un lugar donde no haya mucha humedad
banano,fruta,banano,"banana, plátano, guineo","Fuente de minerales y vitaminas, si usted desea reducir el cansancio, evitar fatigas y alargar la salud de su corazón, no deje pasar nunca la ocasión de comerse un banano. Recuerde que al comerlo está usted, no solo alimentándose, sino también honrando la fama mundial de los bananos costarricenses.",,El archipiélago Indo-Malayo es la cuna del banano. Los buñuelos de banano son un plato típico de la comida callejera malaya y comer sobre hojas de plátano es costumbre ancestral en la India.,True,"Minerales como el magnesio, el hierro, el potasio, el zinc  y el manganeso, presentes en altas dosis en el banano, contribuyen a robustecer la salud muscular. Rico en calcio, el banano fortalece dientes, huesos y cabello.",,Nunca debereían de ser conservados en el refrigerador. Pueden congelarse sin cáscara si se ponen oscuros y usarse en preparaciones como batidos.
berenjena,fruta,berenjena,,"La berenjena, no es sólo un emoji popular, sino que también es una fuente enorme de fibra y potasio con una bajísima cantidad de calorías por porción. Estas propiedades la convierten en un alimento completo y saludable, además de ser un excelente aliado para las personas que buscan perder peso.",,"Como almas gemelas, la berenjena es el complemento perfecto en guisos y curries históricamente elaborados en la región subcontinental de la India, tierra donde este fruto de numerosos nombres dio sus primeros pasos.",False,"La fibra de la berenjena favorece el buen estado de la flora bacteriana, mientras sus antocianinas provocan un efecto antioxidante. Compuestos químicos presentes en su piel y semillas, estimulan el buen funcionamiento del hígado. ",,Envolverla en servilletas y guardar en una bolsa que no debe de estar sellada
berro,verdura,berro,"mastuerzo, nastuerzo, berraza, berra, berro de agua, mastuerzo de agua, agrón  ","Berro, berro, ¿qué ves? Mucha vitamina C y amplios minerales. El berro es considerado uno de los vegetales más nutritivos y usted está de suerte porque su distintivo sabor picante, parecido al de la mostaza, lo convierte en una adición perfecta para las pastas, pizza, tortas de huevo y ensaladas.",,"Utilizada hasta el Renacimiento como medicina y refrescante para el aliento, esta poderosa hierba etíope, se dice que cura resacas y ha servido a los soldados como remedio contra el hambre a lo largo de la historia.",False,"El berro ofrece notables valores de vitamina A, muy importante para la salud de la visión, la piel, las membranas mucosas y el desarrollo embrionario. Sus útiles cantidades de vitaminas del complejo B son necesarias para prevenir enfermedades coronarias y accidentes cerebrovasculares.",,Guardarlo envolviéndolo en papel toalla un poco humedecida
bokchoy,verdura,bok choy,,¿Cansado de lo cotidiano en su plato? El bok choy es una variedad de col china que se puede comer crumarinada. Hágale justicia al añadirla a sopas o fideos. Con estas maravillosas notas herbáceas bailando entre las verduras y carnes podrá elevar sin mucho esfuerzo el perfil de sabor de sus platos.,,"Esta verdura tiene una diversidad de preparaciones, ya sea en ensaladas o al vapor. La encontramos mucho en la comida asiática, especialmente en el Kimchi, que es un platillo Coreano.",False,"Antioxidantes como el ácido fólico, las vitaminas C y E, y el betacaroteno, son componentes esenciales del bok choy, cuya también notable riqueza en calcio, magnesio y zinc, ayuda a fortalecer nuestros huesos. ",,Puede guardarse en una bolsa de plástico en el refrigerador
brocoli,verdura,brócoli,,"Ganador en textura, practicidad y nutrición, el brócoli es uno de los mejores vegetales que puede incorporar a su dieta. Si necesita una ensalada rápida, hiérvalo y está listo para acompañar carnes, sopas, pastas y más. Si se siente creativo, áselo y acompáñelo con queso cheddar.",,"Planta originaria de los países mediterráneos orientales, antes de ser utilizada como alimento en Europa, esta tuvo fines medicinales. El brócoli se encuentra muy presente en la cocina italiana, debido a que fue un alimento importante para el Imperio Romano. Podemos notar este alimento en preparaciones como pastas, cocida o, inclusive, en jugos.",False,"El sulforafano, compuesto azufrado del brócoli, evita que las células cancerígenas se desarrollen, al tiempo que sus altas dosis de vitaminas B1, B2 y B6, y de yodo, manganeso, zinc y cobre, combaten sin cuartel a la anemia ferropénica.",,Puede guardarse en un recipiente con un poco de agua en el fondo para que se mantenga fresco
camote,raiz,camote,,"El camote es un tubérculo dulce oriundo de América Central y Suramérica. Rico en potasio, vitaminas B y C, y fibra, se vuelve parte importante de la mesa por su valor nutritivo, su variada y fácil cocción y su muy asequible valor monetario en las tarimas de cualquier feria.",,"De raíz mesoamericana, al camote, que no es tubérculo sino raíz, se le llama “la comida de pobres”. El camote horneado bañado en leche condensada es plato habitual de la comida mexicana.",True,"La elevada cantidad de potasio del camote reduce la presión arterial, mientras sus flavonoides reducen las inflamaciones y funcionan como eficientes antioxidantes. La vitamina A que posee el camote es nutriente básico para combatir infecciones.",,En un lugar seco y oscuro
carambola,fruta,carambola,,"¡Esta fruta es toda una estrella! Literalmente... La carambola es muy conocida por su delicioso sabor a la hora de tomarla en un refresco natural, pero también por ser un ícono tropical por las porciones en forma de estrella que se forman al rebanarla.",,"La carambola o fruta estrella es nativa del sudeste asiático, donde se le consume con frecuencia madura, guisada con azúcar y clavo de olor, y en ocasiones con manzana. En Tailandia suele comerse con camarones.",True,"Su carga de vitaminas A y C le da notable valor antioxidante a la carambola, y una mejor preparación al organismo para contrarrestar infecciones, formar glóbulos rojos y fortalecer los huesos. Su aporte en potasio sirve para el mejoramiento de la actividad muscular. ",,"Si al comprarla está verde, se debe guardar a temperatura ambiente. Si está madura, debe refrigerarse."
cas,fruta,cas,,Una de las especialidades de Costa Rica y una buena elección para convertir en jugo. El cas promete un profundo sabor agridulce con una potente dosis de vitamina C en cada sorbo.,,"Originario de Centroamérica, se presume que el cas nació en Costa Rica. Esta fruta, extendida desde el sur de México hasta Ecuador, recibe diversos nombres, desde guayaba ácida hasta guayaba de agua, ya que se consume principalmente en refrescos.",True,"El cas fortalece el sistema inmunológico con su alto contenido de vitamina C, sin demeritar el valor antioxidante y preventivo del cáncer de los componentes fenólicos presentes en su cáscara y pulpa.  ",,"Si al comprarlo está verde, se debe guardar a temperatura ambiente. Si está maduro, debe refrigerarse."
cebolla,verdura,cebolla,,"La cebolla marca un antes y un después en nuestra cultura culinaria. Es integrante de la tríada fantástica de la sazón, junto con el chile dulce y el ajo. Su inigualable sabor la hace esencial en sofritos, ensaladas, salsas y más. Nos hizo llorar, pero ¡eran lágrimas de alegría!",,Verdura proveniente de Asia Central y conocida por ser una de las mejores hortalizas para sazonar cualquier platillo salado. En América llegó junto con los primeros colonizadores y nuestro país es muy utilizada como sazonador base del arroz y el gallo pinto. ,True,"Los elementos antioxidantes de la familia de los flavonoides presentes en la cebolla, son antiinflamatorios, vasodilatadores, analgésicos y protectores contra el cáncer por excelencia, especialmente los cánceres de mama, próstata y colon.",,En un lugar oscuro y aireado
cebollino,verdura,cebollino,,"El cebollino es un delgado tallo hueco de grato aroma que suele cortarse en diminutos pedazos y agregarse a platos de carne, huevos, papas al horno, ensaladas o sopas, para que su aporte a la mezcla de colores y olores enriquezca nuestras producciones culinarias.",,"Con orígenes velados, el cebollino es un presunto nativo de Europa y China. Todas sus partes, excepto el bulbo, son comestibles: desde la flor hasta las hojas. En la cocina asiática, deslumbra en pancakes de kimchi, gyoza y variadas sopas.",False,"Como parte de la familia allium, el cebollino contiene componentes con propiedades anticancerígenas y, en cantidades reducidas, aporta colina, nutriente clave para el bienestar emocional y el sueño reparador.",,Puede guardarse en un recipiente con un poco de agua en el fondo para que se mantenga fresco
chan,otro,chan,,"¡La parte más importante del fresco de chan! Las semillas de chan, también conocidas como chia, son únicas. Estas absorben más de 10 veces su peso en agua, lo que las convierte en un alimento saciador, además de darle esa textura gelatinosa al fresco.",,"Provenientes de Mesoamérica, estas semillas son la elección predilecta en América Central y del Sur para garantizar el toque extra saludable en bebidas, desde limonadas hasta tés.",False,"Su alto contenido en proteínas y fibra, sumado a su fácil consumo, le han ganado el título de superalimento. No solo eso, sus proteínas globulinas ayudan a reducir los niveles de colesterol y azúcar en la sangre.",,En un lugar seco y a temperatura ambiente
chayote,verdura,chayote,,En Costa Rica el chayote es la punta de lanza de las hortalizas. Un picadillo que incluya cubitos crudos de raíz de chayote - ese controlador natural de los niveles de azúcar en sangre - es una estampilla de la cocina tica tradicional.,,"Producto importante en la época precolombina ya que fue perteneciente a la dieta de la cultura maya y azteca. Nuestro país y México son los principales productores de esta deliciosa verdura, con ella podemos realizar el famoso picadillo de chayote  o las “chancletas” plato típico de nuestra cocina costarricense. ",True,"Hidratante alimento, fuente destacada de fibra y flavonoides, componentes apreciados por sus propiedades antiinflamatorias, anticancerígenas y antioxidantes. Todas sus partes son apreciadas en la medicina tradicional.",,Puede guardarse en una bolsa de plástico sin sellar
chiledulce,verdura,chile dulce,,"Multifuncional verdura que contiene altas dosis de vitaminas C, E y antioxidantes, el chile dulce es parte de la tríada fantástica de la sazón, junto con el ajo y la cebolla, y puede comerse triturado, crudo, asado. No prescinda usted de la posibilidad de incorporar un proteico chile dulce a su dieta diaria.",,"De raíz mesoamericana, el chile dulce, ya sea en su variante verde o roja, es ingrediente común en picadillos, escabeches y guisos de la cocina yucateca, de Tabasco y Chiapas, estados del sur mexicano.",True,"Su alto contenido de vitamina C, vitamina E y carotenoides, convierten al chile dulce en un eficaz antiinflamatorio y antioxidante. Las grandes cantidades de fibra del chile dulce, ayudan a mantener nuestro sistema digestivo en movimiento.",,Se pueden colocar en bolsas de plástico perforadas antes de meterlos al refrigerador
chilepicante,verdura,chile picante,,"Pequeño pero matón. El chile picante es infaltable en la comida caribeña. No sólo brilla en salsas, sino que también añade personalidad a sus platos, lo cual hace de cada bocado una experiencia intensa.",,"Aunque de uso extendido a las culturas asiáticas, por su origen, se identifica al Chile Picante con Mesoamérica. Dígase México y ya estará usted pensando en una variedad abrumadora de platos que incluyen al chile picante. Con el chile poblano, un pimiento verde picante, se elabora el plato nacional mexicano: los chiles en nogada.",False,"Las propiedades antiinflamatorias y antioxidantes de la capsaicina, componente básico del chile picante, ayudan a mantener un sistema cardiovascular saludable y a disminuir la presión arterial, pero además tienen un efecto beneficioso para la formación de la microbiota intestinal y el control del peso corporal.",,Se pueden guardar en tarros de vidrio en la despensa
chilote,verdura,chilote,"maíz baby, mini mazorca","Desde Paso Canoas hasta Peñas Blancas, un buen guiso caliente de chilote es plato que se invita solo a la mesa de los costarricenses. Su presencia y dulce sabor es también acompañante de sopas, picadillos, carnes, e, incluso, vinagretas. ",,"Aunque el maíz tiene sus raíces en Mesoamérica, el chilote, una variedad aún sin madurar, revela sus primeros usos culinarios en Asia, especialmente en China y Tailandia, sus principales productores y consumidores hasta hoy. En esta región, es común encontrar el chilote en platos como currys, salteados o como deditos fritos.",False,"Excelente fuente de potasio, ácido fólico y vitamina E, conocida por ser antioxidante y anticuagulante. Si busca cuidar sus niveles de azúcar en sangre, considere el chilote antes que el maíz, pues este primero tiene un índice glucémico menor.",,
ciruela,fruta,ciruela,,"Ya sea cruda, en batidos acompañando a otras frutas, o en mermeladas, pasteles o pudines, la dulce ciruela será siempre una apetecible fruta. Muro de contención de la diabetes, es admirable su capacidad para reducir los niveles de glucosa en sangre.",,"La ciruela se consume tradicionalmente seca o deshidratada en la región caucásica y en Persia, sus lugares de origen. No todas las ciruelas se comen de esta manera, pero el consumo de la variedad que se cultiva para secar ya se ha extendido por todo el mundo.",False,"Considerada un antioxidante superior, la ciruela es además una fuente destacada de vitaminas A y B y un regulador de los efectos nocivos de los radicales libres. Su variedad en pasa actúa como un laxante natural, promoviendo la salud del tracto gastrointestinal.",,Separar las ciruelas duras de las suaves
