product_url,category,common_name,common_name_alternate,description,name_origin,center_origin_notes,food_basket,nutrition_notes,preparation_notes,storage_notes
lenteja,legumbre,lenteja,,"He aquí las ganadoras del aporte proteico entre las legumbres. Ricas en fibra y aliadas para bajar el colesterol, estas legumbres coronan desde guisos hasta ensaladas con su sabor y nutrición. ",,"Originarias de Asia Menor en el Creciente Fértil, las lentejas se encuentran en muchos platos asiáticos, a menudo cocinadas junto con arroz debido a sus tiempos de cocción similares. En Egipto, el ""kushari"", plato nacional, es una mezcla de lentejas, garbanzos, arroz y pasta, creando una opción vegana altamente nutritiva.",False,"Destacada fuente de proteína vegetal, con 18 gramos por cada taza, las lentejas son además fuente de hierro, haciéndolas una opción ideal para dietas vegetarianas. Estas legumbres son además altas en fibra, lo que las convierte en aliadas para mantener un intestino saludable.",,En un lugar seco y oscuro
limon,fruta,limón,,"No ha vivido del todo quien no haya tomado una limonada bien fría, ni ha comido sabroso aquel que no haya utilizado un limón al sazonar sus alimentos, al preparar pescados y carnes. Sin rivales a la hora de marinar y aromatizar alimentos, el limón es también el comodín todoterreno de la cocina",,"De origen incierto, se sospecha que el limón se gestó en el subcontinente indio. En las tierras indias, el encurtido de limón es una guarnición común servida en los restaurantes. Un desayuno tradicional del sur de la India es el ""chitranna"", arroz condimentado con jugo de limón que se come solo.",True,"El cóctel de vitaminas B, C y E presentes en el limón, más su aporte en minerales como el hierro, manganeso, cobre, potasio y zinc, funciona como coraza protectora de nuestro sistema inmunológico, protege nuestros tejidos, desinflama las lesiones, facilita la absorción del propio hierro y lo convierte en un antiviral y antibacterial efectivo.",,En un lugar seco y oscuro
linaza,otro,linaza,,"El boom de las semillas de linaza lo consolidó su aporte de Omega 3 a la salud humana y su incorporación a los panes y galletas integrales. Molida e incluida en ensaladas, sopas, cremas, como infusión o en el yogur en el desayuno, la semilla de linaza es hoy por hoy un estandarte culinario",,"Los antiguos egipcios utilizaban la linaza, oriunda del Mediterráneo, para hacer lienzos. El salmón rostizado con pesto de linaza, avala el enfoque saludable de los platos de la cocina mediterránea.",False,"Componentes minerales de la linaza como el manganeso y el magnesio, contribuyen al adecuado desarrollo de los huesos, al tiempo que el ácido alfa linoléico de la semilla tiene propiedades antiinflamatorias, funciona como reductor del colesterol y soporte de la buena salud del sistema cardiovascular. Por su contenido en fibra, la linaza es utilizada para aliviar los síntomas del estreñimiento.",,En un lugar seco y oscuro
maiz,verdura,maíz,,"El maíz, planta sagrada entre los indígenas de América, se destaca por la creatividad culinaria en torno a él  y por su alto aporte de energía. Patrimonio cultural costarricense, esta verdura es la base de las chorreadas, bizcochos y diversas creaciones culinarias, tanto dulces como saladas.",,"De raíz mesoamericana, es considerado un alimento sagrado dentro de la cultura azteca. El pozol, las tortillas de maíz, el postre Pinole, las quesadillas, las enchiladas, las gorditas y los tacos son todos platillos clásicos de la gastronomía mexicana que utilizan el maíz en sus recetas.",True,"La presencia del calcio entre sus nutrientes ayuda a mantener fuertes nuestros huesos. Rico en ácido fólico, el maíz se recomienda tanto a embarazadas como a mujeres lactantes, y su vitamina B1 cuida nuestra salud cardiovascular, reduciendo la posibilidad de sufrir ataques al corazón.",,Guardar en la parte baja del refrigerador 
malanga,raiz,malanga,,"No hay cuerpo humano que no agradezca un buen puré de malanga, unas frituras de malanga, un trozo de carne o unas legumbres acompañadas por una ración de malanga, ese tubérculo controlador natural de la glucemia y reductor de indeseados eventos cardiovasculares.",,"Según antigua leyenda hawaiana, la malanga es un niño que creció dentro de esa planta y a partir de ahí se formó la especie humana. Originaria de la India, allí se come frita o al vapor y es un sabor omnipresente en las panaderías al estilo del Medio Oriente. ",False,"Con casi el doble de fibra que la papa, la malanga ayuda a controlar los picos de glucosa en el organismo, retarda la glucemia posprandial, mejora la salud intestinal y reduce las enfermedades coronarias. Su aporte en vitaminas A y C tiene efectos antioxidantes en el organismo.",,Espacio oscuro y con buena ventilación 
mandarina,fruta,mandarina,,"Deliciosa fruta para saborear entera, gajo a gajo, o en jugo. La mandarina es tan singular por su dulce sabor, que uno termina colocándola entre los cítricos favoritos. Las habituales infusiones hechas con su cáscara la convierten en una fruta completamente aprovechable en términos culinarios.",,Se cree que es originaria del sur de Asia. La carne con mandarina es un plato clásico de China que usted probablemente ha escuchado como “pollo a la naranja”.,True,"Rica en vitamina C y compuesta en un 85% de agua, la mandarina potencia nuestro sistema inmunológico contra virus y bacterias. Además, beneficia la salud de nuestra piel, ya que la vitamina C contenida en esta estimula la producción de colágeno, contribuyendo así a una piel tersa y saludable.",,"Se puede conservar a temperatura ambiente o en refrigeración, siempre y cuando no se apilen y pueda circular el aire entre ellas."
mango,fruta,mango,,"El mango no solo aporta generosas dosis de vitaminas A y C, sino que, además, nuestra piel y huesos agradecen su consumo. Versátil fruta tropical de múltiples usos culinarios, podemos comerla cruda, en batidos, en ensaladas, incorporarla a la repostería, cocinarla a la plancha e, incluso, comerla deshidratada como crujiente snack.",,"El mango ha recorrido un largo camino para llegar a nosotros. Originario de la India, allí el mango es apreciado por su acidez, la cual es usada para condimentar curris y elaborar encurtidos.",False,"Además de ofrecer un variado cóctel de vitaminas inmunoprotectoras como la A y la C, su contenido en fibra insoluble fomenta la salud intestinal al prevenir la constipación. Al mismo tiempo, su fibra soluble contribuye a reducir los niveles de colesterol malo. Dado su elevado contenido de azúcar natural, se aconseja consumirlo con moderación para evitar picos de glucosa en la sangre.",,Se conserva bien a temperatura ambiente
manzana,fruta,manzana,,"La manzana es, quizá, la reina de las frutas. Proveedora de vitaminas B y C y de minerales como calcio y fósforo, puede usted disfrutarla cruda o en compotas, pasteles, guisos, postres o como otro sano ingrediente en ensaladas. ""Una manzana al día, al doctor alejaría"", reza un viejo refrán.",,"La manzana, originaria de Asia Central, se ha esparcido por todo el mundo, nutriendo tanto cuerpos como relatos a lo largo de las eras. “La fruta de la paz”, como es también llamada en China, es a menudo consumida allí como postre frito acompañado de caramelo.",True,"Abundante en fibra soluble, la manzana se ha revelado como una aliada crucial para la salud cardiovascular, demostrando prevenir problemas cardíacos cuando se consume de manera regular. Gracias a sus compuestos naturales, como los polifenoles, diversos estudios respaldan que su ingesta contribuye significativamente a la prevención de la diabetes tipo 2.",,"En un lugar fresco, seco y oscuro"
manzanadeagua,fruta,manzana de agua,,"Fruta carnosa y más jugosa que la manzana habitual, suele comerse fresca, a mordiscos. De haberse comido Eva una manzana de agua, es probable que no hubiera querido compartirla, y las Sagradas Escrituras y la especie humana habríamos tomado quizá otro rumbo.",,"Nativa del sudeste asiático e indio, esta fruta, debido a su delicada piel, es difícil de exportar, por lo que se disfruta principalmente a nivel local. Considerada una exquisitez regional, en las islas del océano Indio, se emplea con frecuencia en ensaladas y encurtidos.",False,"Con una buena carga de antioxidantes como quercetina y ácido gálico, la manzana de agua reduce el estrés oxidativo y la inflamación en el cuerpo. Esta además posee propiedades reguladoras de glucosa y es un alimento altamente hidratante.",,
manzanilla,hierba,manzanilla,,"Un té de flores y hojas de manzanilla siempre será oportuno para aliviar los síntomas de un resfriado, como infusión digestiva o relajante, y para calmar los mareos. Su aroma es, además, ingrediente de algunas sopas y sugerentes salsas que se utilizan para cocer el pollo. ",,"La manzanilla siempre ha sido una planta importante gracias a sus propiedades curativas, utilizada desde épocas antiguas como en la cultura egipcia y la greco romana hasta nuestros días. Mejor conocida en la preparación de té, aceites esenciales o bien para uso cosmético.",False,"La quercetina, sustancia antioxidante presente en la manzanilla, contribuye a regular el metabolismo, mientras que la crisina, también presente en esta hierba, reduce los síntomas de trastornos relacionados con la ansiedad y facilita el sueño. Además, la colina, compuesto de la vitamina B, protege al hígado de la acumulación de grasa.",,En un lugar seco.
maracuya,fruta,maracuyá,,"Si desea comer cruda esta fruta, agarre usted una cuchara y disfrute la pulpa gelatinosa del maracuyá. También puede licuarla y tomarla a la manera de un batido, pero si cocinarla es la intención, las deliciosas cremas, tartas y mermeladas de maracuyá lo esperan.",,"El verano de la región brasileña-paraguaya lo vio nacer, el maracuyá, fruto de pasión. No hay duda de que en esta región han sabido sacarle el jugo pues, hasta el día de hoy, Brasil se mantiene como el líder productor de maracuyá.",True,"Rico en hidratos de carbono y agua, el maracuyá es alimento perfecto para recuperar energías. Su alto contenido de vitamina A es esencial para la buena salud de las mucosas, los huesos, la visión y el sistema inmunológico. Su elevada dosis de vitamina C favorece la absorción de hierro y es básica para la formación de huesos, glóbulos rojos y colágeno.",,Guardarla en el cajón de las frutas.
melocoton,fruta,melocotón,,"Ya sea para comerlo a puros mordiscos o en ensaladas de frutas; o cocinado ya, en mermeladas, pasteles y postres, siempre le ayudará esta fruta antioxidante con textura de terciopelo a detener el tiempo y a reducir sus niveles de colesterol y su presión arterial.",,"Luego de ser domesticado en su país de procedencia: China, el melocotón viajó a Japón, India, Persia y finalmente a Europa gracias a la Ruta de la Seda. Para la cultura china esta fruta representa una larga vida. Además de tener un sabor perfecto para la elaboración de platos agridulces, los cuales son representativos en la cocina Oriental, también es una fruta ideal para postres y bebidas. ",False,"Repletos de vitamina A, los melocotones son de gran ayuda para mantener una piel saludable, reducir inflamaciones y sostener el sistema inmunológico, así como para reducir la hipertensión arterial por la presencia en ellos de minerales de potasio y sodio. Por sus notables valores en fibra, los melocotones regulan el tránsito intestinal y eliminan el estreñimiento. ",,Se pueden guardar en bolsas herméticas en el refrigerador.
melon,fruta,melón,,"Tal vez la más refrescante de las frutas, aunque se puede consumir en ensaladas, como jugo, o en escabeche, el melón se digiere y aprovecha mejor si se lo come solo. Rico en vitamina C y antioxidantes, los calores del verano se atenúan mejor disfrutando un melón.   ",,"Se presume que la cuna del melón se encuentra en África, aunque se considera que su origen podría extenderse a diversas partes de Asia. En África, las semillas del melón son empleadas para la elaboración de aceite de cocina. En el sureste de Asia, ciertas variedades de melón se consumen como vegetales, preparadas en sabrosos salteados.",True,"Por su contenido de potasio y magnesio el melón contribuye al soporte del equilibrio hídrico del cuerpo, a la contracción muscular y al mantenimiento saludable de huesos y dientes y del sistema cardiovascular. Las vitaminas A y C presentes en el melón, favorecen el buen estado de la piel y las mucosas, y la reparación y cicatrización de tejidos. ",,"Puede guardarse a temperatura ambiente. En caso de almacenarlo en el refrigerador, se podrá guardar en una bolsa de plástico perforada para mantener la humedad."
menta,hierba,menta,,"Por su peculiar, intenso y grato olor y sabor es la menta un aromatizante natural hasta de la propia vida. Cócteles, infusiones, postres, helados, ensaladas, y algunas exóticas recetas de pollo y pescado con la menta como base o ingrediente no dejan espacio a dudas.",,"Al aceite esencial de menta, refrescante hierba de origen Mediterraneo, se le atribuyen en la región cualidades como energizante emocional y estimulante. La menta es además un paliativo recurrente allí para aliviar dolores, náuseas y mareos.",False,"Rica en nutrientes como vitaminas A y C, hierro y folato, la menta destaca por sus propiedades antibacterianas. Masticar sus hojas o tomarla en té elimina el mal aliento de raíz al extinguir las bacterias bucales, mientras que previene y alivia síntomas de úlceras en la boca. Al ser además una estimulante de las enzimas digestivas, la menta facilita la digestión.",,Envolverla en una servilleta de papel en un recipiente o bolsa hermética.
mora,fruta,mora,,"Pequeña fruta silvestre que entre las bayas por su sabor y valor se agiganta. La mora es un antiinflamatorio y antioxidante rico en vitaminas A y C, a la que, ya sea en su forma natural, o en pasteles, yogures, jaleas, mermeladas o siropes, su paladar y su salud un monumento le levantan.",,"Posiblemente originaria del Mediterráneo y Asia Central, la mora ha sido un elemento destacado en el folclore británico. En la actualidad, una de las formas más comunes de disfrutar de las moras en la región es a través de la jalea, usualmente acompañada de pan. En algunas partes de Asia, la mora se incorpora en salsas para potenciar el sabor de las carnes.",True,"Considerada la reina de las bayas, la mora contiene una de las mayores concentraciones de antioxidantes entre todas las frutas, beneficiosos para la salud cerebral. Su alto contenido en vitamina C sugiere posibles beneficios anticancerígenos al eliminar del cuerpo sustancias relacionadas al cáncer, mientras que su fibra favorece la salud intestinal.",,Colocarla en un recipiente con tapa dentro del refrigerador.
mostazachina,verdura,mostaza china,,"Cruda, o cocida, agréguele unas hojas de mostaza china a sus ensaladas, a sus carnes, al chop suey, al arroz frito, a los huevos, y estará usted, sin proponérselo acaso, agregando un pasajero más a una de las regiones más saludables de la cultura culinaria.  ",,"De origen impreciso, su raíz se le atribuye a la China e India. Dentro de la cocina china, el Chou Mei, un plato que incluye, entre otros ingredientes: carne de res, fideos de harina, ajo, pimiento, lechuga y hojas de mostaza china, se considera un clásico de la comida regional.",False,"Este vegetal posee niveles sobresalientes de vitaminas A y K, que aumentan durante la cocción, llegando a superar el 100% de los valores diarios recomendados. La vitamina K es esencial para prevenir coágulos en la sangre y problemas del corazón, así como mantener la salud del cerebro. Adicionalmente, la vitamina A apoya el sistema inmune y favorece el crecimiento.",,
mozote,hierba,mozote,,"Anímese usted a tomar un fresco elaborado con el leñoso tallo del mozote y ya verá cómo su estómago se refresca y, además, se lo agradece. Tómelo solo, tómelo mezclado con Tamarindo o con Cas, con algo de azúcar o con vainilla, pero tómelo.  ",,"El mozote es una planta de tallo leñoso y flores amarillas, originaria de Mesoamérica y Centroamérica. El fresco de mozote es bebida recurrente en algunas regiones de Costa Rica.",False,"El mozote posee compuestos naturales capaces de limpiar el colesterol malo y los triglicéridos, al tiempo que aumentan el colesterol bueno. El interior de su tallo alberga una sustancia viscosa ampliamente utilizada para el tratamiento de problemas renales y como un diurético.",,En un lugar seco
naranja,fruta,naranja,,"Haya encontrado o no usted a su media naranja, siempre tendrá ocasión de cortar en dos mitades, exprimir y disfrutar el sabroso jugo de una refrescante y dulce naranja real. Por las tierras de las cremas pasteleras a la cáscara de la naranja sin recogimiento alguno se la ve pasar.",,"Según el Confucianismo, la naranja, una fruta cuyo origen geográfico se ubica en el Asia Oriental, lleva en sí el color de la transformación. En la China se considera a la naranja fuente de prosperidad y buena fortuna.",True,"Su elevado contenido de vitamina C es un pilar antioxidante para la restauración celular, la eliminación de radicales libres y la solidificación del sistema inmunológico. Como fuente de vitamina A, la naranja mantiene en buen estado la piel, las mucosas, la retina, los tejidos blandos y los huesos. Con sus folatos la naranja previene las anemias y ayuda a la formación de glóbulos rojos. ",,"En un lugar seco, oscuro y lejos de la humedad"
name,raiz,ñame,,"El ñame se deja comer como mejor le parezca a usted; frito, al vapor, al horno o hervido. Dado su bajo costo, su buen sabor y su riqueza en potasio, fósforo, calcio y vitamina C, el ñame puede llegar a ser un tubérculo infaltable en la mesa de cada hogar.",,"En la India, su lugar de procedencia original, los chips de ñame acompañan las comidas religiosas. Los ñames silvestres son materia prima esencial de laboratorios para elaborar hormonas y anticonceptivos orales.",False,"Su importante cantidad de potasio es una ayuda para el buen funcionamiento del sistema nervioso, la frecuencia cardiaca y la presión arterial, y su alto contenido de fibra regula el tránsito intestinal. Las vitaminas del complejo B del ñame favorecen la buena salud del sistema circulatorio, y su vitamina C fortalece el sistema inmunológico.  ",,En un lugar oscuro y con poca humedad
nampi,raiz,ñampí,malanga,"Puede que no sea tan conocida como la yuca o el camote, pero la malanga no tiene nada que envidiarle a estos otros tubérculos. Es un excelente complemento para una olla de carne o puede, incluso, hacerla en picadillo.",,"Aunque se cultiva en todas las zonas tropicales y subtropicales del planeta, el ñampi tiene en Oceanía y el Asia tropical su probable región de origen. En la cocina de los 5 continentes se le utiliza  como acompañamiento habitual de carnes y pescados.",True,"Tubérculo energético con gran cantidad de fibra dietética, ayuda a acelerar el proceso digestivo y disminuir el colesterol en el cuerpo. De abundante potasio y vitamina C, el consumo de ñampí previene las enfermedades cardiovasculares, mejora la capacidad de respuesta del sistema inmunológico y elimina los radicales libres. ",,En un lugar oscuro y con poca humedad
oregano,hierba,orégano,,"Condimento indispensable para carnes, pastas, verduras, pizzas, salsas, pescados, quesos, ensaladas y sopas. Especia de lujo en cualquier cocina, el sabor y el aroma de su comida se enriquecerán siempre con un toque de orégano.",,"De raíz mediterránea, se considera en su lugar de origen que el humo del orégano aleja a los demonios. El Medioevo europeo ahuyentaba a sus ahora legendarias brujas con plantas de orégano.",False,"Fuente potencial de vitamina C y carotenoides, el orégano protege las células contra el daño oxidativo y retarda el envejecimiento y la aparición de enfermedades crónico-degenerativas como el cáncer, la diabetes y las enfermedades cardiovasculares. La beta-cariofilina del orégano funciona como antiinflamatorio y es eficaz frente a la osteoporosis. Adicionalmente, sus fenoles carvacrol y timol funcionan como antimicrobianos.",,En un lugar seco
palmito,verdura,palmito,,"Entre los platos más auténticos de la cocina tica está el arroz con palmito. Casi siempre en rodajas, puede cocerlo de varias maneras: al vapor, sofrito, al horno, asado o a la parrilla. En asuntos de salud, encontrará en el palmito un vegetal hipocalórico que aporta fibra y vitaminas.",,"La palmera de palmito tiene su lugar de origen en las zonas andinas de América del Sur. En la gastronomía amazónica, en la región selvática peruana, se utiliza el palmito en la elaboración de ensaladas.",False,"Bajo en grasas y rico en minerales como hierro y zinc, el palmito destaca por su alta carga de potasio, mineral que controla la presión arterial al eliminar los efectos dañinos del sodio en la sangre. Gracias a su contenido en vitamina B6, el palmito puede ayudar a disminuir las náuseas y contribuye al adecuado desarrollo del cerebro.",,Escurrirlos bien y envolverlos en plástico de cocina para que se mantengan frescos por más tiempo
papa,raiz,papa,,"Tubérculo universal que de mil maneras podrá elaborarar ¡Cómo podría gozarse del todo la vida, sin una buena ración de papas fritas! Es la papa, además, la madre de los purés, de las ensaladas y las sopas, de los alimentos hervidos, al horno, y de los snacks. La madre, en definitiva, de nuestros alimentos.",,"La papa no solo ha sido un alimento importante para la cultura Andina que fue su centro de origen y en donde se encuentra una gran variedad de estas. Si no que hoy en día también representa una verdura importante para la dieta mundial y la para la elaboración de platos típicos en diferentes países, por ejemplo en España conocemos la famosa torta española, en Italia los ñoquis, en nuestro país el picadillo de papa y no olvidar las famosas papas fritas muy conocidas en la mayoria de paises. ",True,"Considerada una de las mejores fuentes de potasio y con una alta carga de vitamina C, la papa contribuye a regular la presión arterial y a fortalecer el sistema inmunológico. El almidón resistente presente en esta es asociado con una mayor efectividad del cuerpo para eliminar azúcares dañinos de la sangre y con una microbiota intestinal sana. No prescinda de su cáscara, pues esta contiene gran parte de sus nutrientes.",,"Almacenar en un lugar oscuro y seco, evitando que les pegue la luz del sol directamente "
papaya,fruta,papaya,,"Fruta tropical de dulce pulpa, se deja comer cruda y madura en jugosos trozos de un color naranja que recuerda ciertos bellísimos crepúsculos. Pero no desaproveche la posibilidad de consumir también la digestiva papaya a la manera de un batido, un postre o una sabrosa mermelada. ",,"Originaria de Mesoamérica y presuntamente domesticada por los mayas, la papaya es apreciada en México por su docilidad para la elaboración de postres. Se emplea para crear dulces y salsa de papaya, esta última complementa una amplia gama de platos, desde carnes hasta ensaladas.",True,"Con un destacado contenido de vitamina C, la papaya rebosa de antioxidantes con una mayor facilidad de absorción que en otras frutas. Por el licopeno en esta presente, la papaya disminuye el estrés oxidativo vinculado al envejecimiento y al cáncer. La papaya además se compone de papaína, una enzima capaz de aliviar la constipación y facilitar la digestión de la proteína.",,En el lugar menos frío del refrigerador 
pejibaye,fruta,pejibaye,,"Nacido de palmera, el pejibaye es una fruta infaltable en la mesa tica. Suele prepararse de preferencia cocido en agua y sal, para comer caliente con mayonesa. Y no obstante, en ensaladas, sopas y pasteles también puede disfrutarse su peculiar sabor. ",,"Conocido en nuestro país por su famoso nombre como “pejibaye"". Y en Nicaragua como “chontaduro”. Esta fruta fue importante en épocas precolombinas ya que fue fuente principal de alimento y bebidas. Un dato importante de esta fruta es que en la poblacion Bribri se realiza chicha a base de esta.",True,"Con una buena carga de carbohidratos, el pejibaye destaca como un alimento energizante con 37 gramos de carbohidratos por cada 100 gramos. Gracias a su contenido en vitaminas A y C, potasio y calcio, el pejibaye es un aliado de nuestra piel, al estimular el crecimiento de nuevas células, mantener el equilibrio de humedad y fortalecer la barrera cutánea.",,
pepino,verdura,pepino,,"Es casi agua crujiente y el ganador en términos de practicidad. Rebánelo y está listo para ser añadido a cualquier ensalada, pero no subestime lo bien que se lleva con los ingredientes de un salteado. Además, por sus conocidas propiedades hidratantes y contenido de vitamina C, es esencial para una piel sana.",,"El pepino es originario de la India y demás zonas tropicales asiáticas. Elaborado con yogur, pepino, vegetales, y especias, la raita india funciona como ensalada cuando es espesa. En un punto medio funciona como salsa. De cualquier manera tanto la raita como el pepino son 2 escuderos de la cocina tradicional de la India",False,"El flavonol, antioxidante presente en el pepino, favorece la conectividad neuronal, a la vez que sus vitaminas del complejo B contribuyen al relajamiento del sistema nervioso. Su aporte en potasio previene la hipertensión arterial y protege al corazón, mientras su vitamina C estimula el sistema inmunitario.  ",,Envolverlos en una servilleta húmeda y mantenerlos en un contenedor hermético.
